제목,지역,소분류,성별,내용
구포ZOOM-IN발굴단,부산,북구,공통,"총 6회기로 진행되는 봉사활동!!""구포동에는 많은 어려운 이웃들이 거주하고 있습니다. 하지만, 장선종합사회복지관의 손길이 닿지 않는 곳이 여전히 존재합니다. 이러한 구포동 주민을 알려주세요.""1회기, 2회기 : 사회복지사와 함께 구포ZOOM-IN발굴단 매뉴얼에 대한 교육3회기, 4회기 : 다른 이웃에게 구포ZOOM-IN발굴단 매뉴얼 전파5회기, 6회기 : 사회복지사와 모니터링 상담6회기 이후 : 어려운 이웃을 발견하면 장선종합사회복지관으로 안내※ 모든 회기는 개별 일정에 맞춰 진행됩니다.★ 혜택1. 자원봉사활동 시간 6시간 인정2. 구포ZOOM-IN발굴단 임명장 수여3. 장선종합사회복지관 ""감사의 밤"" 초청4. 생일축하 문자 및 전화5. 각종 행사 및 홈페이지 등 구포ZOOM-IN발굴단으로 소개어려워 마시고, 언제든 연락주세요~^^※ 자원봉사희망자 정보는 신청자와 관리센터만 볼 수 있습니다.(로그인 필요)"
★재능나눔(동영상 제작 및 편집) 봉사자 모집★,서울,중구,공통,"약수노인종합복지관에서는 지역 내 영세소상공인 홍보마케팅 지원사업 '렌즈속에 담은 우리마을 이야기' 사업운영을 위한 전문 봉사자를 모집하오니, 많은 관심 부탁드립니다.- 활동기간 : 2019년 3월 ~ 6월- 활동방법 : 정기적 모임 및 교육, 홍보물 촬영 및 편집- 참여문의 : 방문(약수노인종합복지관), 전화(02-2234-3515)- 세부내용 : 영세소상공인을 위한 홍보물 제작 및 배포지역 내 소상공인을 위한 홍보활동을 진행할 계획입니다~~ 많은 관심 부탁드립니다!대학생 우대 ★★★※ 자원봉사희망자 정보는 신청자와 관리센터만 볼 수 있습니다.(로그인 필요)"
포토샵 재능기부,경남,창원시,공통,"1. 봉사일자 : 2019-03-05~2019-07-312. 봉사장소 : 자율(자택봉사 가능), 지역상관없음.3. 봉사내용 : 포토샵 재능기부                 어르신 영정사진 헤어, 옷, 화장 등의 포토샵을 통한 사진 보정 활동4. 봉사시간 산정은 봉사자와 논의 후 사후 결정(1장당 산정 예정) ※ 자원봉사희망자 정보는 신청자와 관리센터만 볼 수 있습니다.(로그인 필요)"
매화종합사회복지관 청소년 봉사단 모집,경기,군포시,공통,"매화종합사회복지관 청소년 봉사단 모집1. 모집기간: 03.05(화)~03.16(토)2. 모집대상: 16세~18세 청소년(중3~고2 학령기)3. 활동면접: 03.23(토) 13:004. 활동기간: 03.23(토)~09.14(토) / 2주, 4주 토요일 13:00~15:005. 활동내용: 자원봉사자 교육, 기획봉사(캠페인 준비, 캠페인 활동)                -봉사단이 봉사활동 주제 직접 선정                -활동 주제에 따른 활동 기획                -자원봉사&모금활동(캠페인 중심의 활동)                -캠페인 진행 시 모금 활동 및 기부6. 기타사항   -활동 내용은 청소년들이 직접 기획 및 운영   -활동기간은 3월~9월까지이며, 활동에 80 이상 참여해야 활동시간 인정(장기적인 활동이 가능한 청소년만 신청)   -활동 인원 선발은 면접을 통해 결정   -활동 시간은 2주, 4주 토요일 13:00~15:00까지 진행되지만 방학 때는 일정이 변동될 수 있음7. 문의: 매화종합사회복지관 이돈민 선임사회복지사 031-393-3677※ 자원봉사희망자 정보는 신청자와 관리센터만 볼 수 있습니다.(로그인 필요)"
아름다운가게 울산북구점 정기 주부 자원봉사자,울산,북구,공통,"아름다운가게 울산북구점에서 정기 주부봉사자를 모집합니다 아름다운가게는 시민들과 기업에서 기증해주신 물품을 직접 자원봉사자들이 정리 / 판매 하여 그 수익금으로 다시 지역사회에 나눔하는 대표적인 공익 법인입니다. 북구점 위치는 호계시장,호계역 인근에 있습니다 ^^ - 모집관련 1. 주 1회 / 4시간 활동 하실 주부 자원활동가를 모집 합니다 2.   수요일, 목요일 오후(14~18시)   중 선택가능 3. 매장 내 기증품 접수, 판매관련(포스 및 정리 정돈), 기타 업무 지원4. 봉사자 혜택 : VMS 봉사시간 등록, 아름다운가게 봉사시간 등록, 오전 식사 제공, 오후 간식 제공    사회에 건강한 자원봉사 문화와 더불어 나눔과 순환의 문화를 확산시키고자 노력하고 있습니다.아름다운가게에서는 한 사람의 작은 실천, 관심이 좀 더 따뜻한 사회를 만들어 갈 것이라 생각합니다.당신의 소중한 시간, 재능을 아름다운가게와 함께 해주세요.※ 자원봉사희망자 정보는 신청자와 관리센터만 볼 수 있습니다.(로그인 필요)"
[서울재활협회] 감동의 마라톤 자원봉사자 모집(4/20),서울,영등포구,공통,"1. 활동 내용  ※ 장애인 참가자가 많기 때문에 주의요망- 대 회 명: 제3회 S-OIL과 함께하는 ‘감동의 마라톤’              (http://감동의마라톤.com)- 접수처: 현장 접수인원 확인 및 물품 전달- 출발 및 골인지: 출발 전/후 집결지 통제, 참가자 질서유지- 골인 급수대: 완주자들 물 제공- 간식 배부처: 완주자들 간식 제공- 물품보관소: 참가자 물품을 수령 및 전달, 보관하는 업무 수행- 탈의실: 질서유지, 비닐백 배포- 주로(코스)내 각 교차로 및 골목 차량 통행 안내 및 선수 주로 안내- 5km지점 이후부터 매 5km마다 급수 및 스펀지대 설치 및 선수음료제공 2. 모집기간- 2019.03.04.(월)~2018.04.14.(일) 3. 모집인원- 130명 4. 모집대상- 무관 5. 모임장소- 여의도 이벤트광장(집결지)(지하철 5호선 여의나루역 2번 출구) 6. 모임시간- 2019.04.20.(토), 오전 7시(10분 전까지 도착) 7. 활동날짜 및 시간- 2019.04.20.(토), 오전 7시~오후 1시(총 6시간) 8. 신청방법- 담당자에게 아래 개인 신상 정보 이메일(rikorea-seoul@naver.com) 전달※ 이름/ 성별/ 연락처/ 이메일 주소/ 장애유무/ VMS ID 전달- 접수 후 확정된 봉사자는 개인 연락처로 회신 예정(1차 4/5, 최종 4/18) 9. 기타- 제공사항: 중식, 간식, 물- 지인 및 친구, 동아리 등 단체신청 가능문의) 서울특별시장애인재활협회, 봉사담당 정혜정 02-2637-4162※ 자원봉사희망자 정보는 신청자와 관리센터만 볼 수 있습니다.(로그인 필요)"
[잠실복지관] 놀이터에서 놀이로 봉사하는 놀이터 봉사단 / (목),서울,송파구,공통,"잠실종합사회복지관에서는 아이들과 지역주민의 안전하고 건강한 놀이터를 만들어가기 위한 놀이터 활성화 사업을 진행하고 있습니다.아이들과 함께 하는 놀이 활동을 통해 안전하고 즐거운 놀이터 문화를 만들어가는데 관심있는 대학생, 활동가 여러분의 참여를 기다리고 있습니다.일시 : 2019년 3월 14일 ~ 2019년 6월 20일 (매주 목) / 오후 2시 30분 ~ 오후 5시 30분 (매 회기 별 3시간 활동)        / 학점 이수 사회봉사연계 가능장소 : 잠실종합사회복지관 인근 놀이터 및 공원내용 : 아이들과 놀이터에서 함께 놀이하기 / 놀이터 이벤트 준비와 참여 신청 후 참여 가능 여부를 재확인하기 위해 등록된 휴대전화로 전화 연락을 드릴 예정입니다.문의사항은 02-423-7806~7 강동화 사회복지사에게 해주시면 안내드리겠습니다!놀이를 통해 아이들과 즐거움에 함께 하는 봉사활동에 많은 관심 부탁드립니다 !※ 자원봉사희망자 정보는 신청자와 관리센터만 볼 수 있습니다.(로그인 필요)"
[잠실복지관] 놀이터에서 놀이로 봉사하는 놀이터 봉사단 / (화),서울,송파구,공통,"잠실종합사회복지관에서는 아이들과 지역주민의 안전하고 건강한 놀이터를 만들어가기 위한 놀이터 활성화 사업을 진행하고 있습니다.아이들과 함께 하는 놀이 활동을 통해 안전하고 즐거운 놀이터 문화를 만들어가는데 관심있는 대학생, 활동가 여러분의 참여를 기다리고 있습니다.일시 : 2019년 3월 12일 ~ 2019년 6월 18일 (매주 화) / 오후 2시 30분 ~ 오후 5시 30분 (매 회기 별 3시간 활동)        / 학점 이수 사회봉사연계 가능장소 : 잠실종합사회복지관 인근 놀이터 및 공원내용 : 아이들과 놀이터에서 함께 놀이하기 / 놀이터 이벤트 준비와 참여 신청 후 참여 가능 여부를 재확인하기 위해 등록된 휴대전화로 전화 연락을 드릴 예정입니다.문의사항은 02-423-7806~7 강동화 사회복지사에게 해주시면 안내드리겠습니다!놀이를 통해 아이들과 즐거움에 함께 하는 봉사활동에 많은 관심 부탁드립니다 !※ 자원봉사희망자 정보는 신청자와 관리센터만 볼 수 있습니다.(로그인 필요)"
창원시장애인종합복지관에서 사물놀이를 도와줄 봉사자를 모집합니다,경남,창원시,공통,창원시장애인종합복지관에서 사물놀이활동을 지원해줄 봉사자를 모집합니다.활동일시 : 매주 화 13:30~15:00활동기간 : 3월~10월내용 : 사물놀이활동 지원대상 : 성인 발달장애인※ 자원봉사희망자 정보는 신청자와 관리센터만 볼 수 있습니다.(로그인 필요)
폐지수집어르신 지원 활동,인천,계양구,공통,"계양토리봉사단은 지역사회 내의 폐지수집어르신 지원을 위한 상담 및 물품지원, 캠페인 등 다양한 활동을 진행하고 있습니다.평소 폐지수집어르신 문제에 관심이 있으셨거나 봉사활동에 관심이 있으신 지역주민들의 참여를 기다립니다.감사합니다. ※ 자원봉사희망자 정보는 신청자와 관리센터만 볼 수 있습니다.(로그인 필요)"
[대청복지관] 관내 동아리지원 P/G 자원봉사자 모집  ,서울,강남구,공통,"강남구 일원1동에 위치한 대청복지관에서는 관내 동아리 지원P/G 자원봉사자를 모집합니다. - 모집대상: 대학생 및 성인 (약 6명) *  대학생 및 성인 * 사진, 미술, 한지공예, 풍선아트 활동 경험 및 가능자/ 사회복지 전공자 우대 - 활동기간: 2019년 3월 ~ 12월 (상반기/하반기 나누어 참여가능)- 활동일시: 사진모임) 월요일 13:30~14:30 / 1명 모집               미술모임) 금요일 10:00~12:30 / 1명 모집               한지공예) 수요일 10:00~12:30 / 1명 모집               풍선아트) 목요일 13:00~15:00 / 1명 모집               남성어르신 모임) 목요일 15:00~17:00 / 2명 모집 * 정기/비정기 가능, 담당자 협의 및 조정가능- 활동장소 : 대청종합사회복지관 프로그램실 * 오시는 길 : 3호선 대청역, 분당선 수서역, 2호선 삼성역 인근(15분 내외) - 활동내용: 각 동아리(사진, 미술, 한지공예, 풍선아트, 남성어르신 모임)               재능기부 강의, 활동보조(재료 제단, 이젤 설치, 물 교체 등 단순 활동보조 가능) - 신청방법: VMS 및 전화신청 - 관련문의: 송지현 대리 Tel. 02)459-6332 / 직통: 070-7462-0663  ※ 자원봉사희망자 정보는 신청자와 관리센터만 볼 수 있습니다.(로그인 필요)"
[대청복지관] 장애인 캘리그라피 P/G 자원봉사자 모집  ,서울,강남구,공통,"강남구 일원1동에 위치한 대청복지관에서는 장애인 캘리그라피 P/G ""행복한 일원마을 인권발전소"" 자원봉사자를 모집합니다. - 모집대상: 대학생 및 성인 (2명) * 사회복지, 미술, 홍보·미디어 관련 전공/경험자 우대- 활동기간: 2019년 3월 ~ 12월 (상반기/하반기 나누어 참여가능) - 활동일시: 월요일 14:30 ~ 16:30 (주 1회/ 협의 및 조정가능) - 활동장소 : 대청종합사회복지관 프로그램실* 오시는 길 : 3호선 대청역, 분당선 수서역, 2호선 삼성역 인근(15분 내외) - 활동내용: 프로그램 및 업무지원, 인원 서포터즈 활동 - 신청방법: VMS 및 전화신청 - 관련문의: 김소라 사회복지사 Tel. 02)459-6332 / 직통: 070-7462-0667  ※ 자원봉사희망자 정보는 신청자와 관리센터만 볼 수 있습니다.(로그인 필요)"
장애어린이 주말학교 '포도알 인연맺기학교',전북,전주시,공통,"1. 봉사일자 : 2019-03-30~2019-06-082. 봉사장소 : 전북 전주시3. 봉사내용 : 장애어린이 주말학교 '포도알 인연맺기학교'4. 사전교육 : 2019년 3월 30일(토)포도알 인연맺기학교는 매주 토요일 장애어린이와 함께하는 주말학교입니다.자원활동가와 어린이가 1:1로 짝꿍을 맺어음악, 미술, 체육, 나들이 등 다양한 활동을 통해 아름다운 토요일을 만들어갑니다. ※ 자원봉사희망자 정보는 신청자와 관리센터만 볼 수 있습니다.(로그인 필요)"
행정업무 보조 봉사,서울,서초구,공통,1. 봉사일자 : 2019-03-04~2019-04-302. 봉사장소 : 데이케어센터 사무실3. 봉사내용 : 행정업무 보조 봉사※ 자원봉사희망자 정보는 신청자와 관리센터만 볼 수 있습니다.(로그인 필요)
[송파구방이복지관]성인장애인 요가교실 봉사자 모집,서울,송파구,공통,"송파구방이복지관에서는 성인장애인을 대상으로 요가교실을 진행함에 따라, 자원봉사자를 모집합니다.많은 관심과 참여 바랍니다.-일시: 3월 4일~12월 18일 매주 월, 수 11:00~12:00-장소: 송파구방이복지관-대상: 성인장애인-내용: 성인장애인 요가 동작 지도 보조※ 자원봉사희망자 정보는 신청자와 관리센터만 볼 수 있습니다.(로그인 필요)"
[울산남구건강가정·다문화가족지원센터] 사무보조 자원봉사자 모집,울산,남구,여,"[울산남구건강가정·다문화가족지원센터 자원봉사자 모집 공고]울산남구건강가정·다문화가족지원센터에서는 함께 일할 자원봉사자를 다음과 같이 모집하오니 많은 신청 바랍니다. 1. 활동내용 : 사무보조업무2. 자격요건 : 워드, 엑셀, 기타 문서작성 유능자, 매주 1회 정기적으로 봉사 가능한 자3. 활동기간 : 2019년 3월 ~ 2019년 12월, 매주 1~2회(담당자와 추후 상의)4. 모집인원 : 1명5. 봉사활동 장소 : 울산남구건강가정·다문화가족지원센터 사무실(남구 대공원로 84, 옥동 가족문화센터 A동 3층)5. 신청방법 : 070-4402-9978(전화신청)※ 자원봉사희망자 정보는 신청자와 관리센터만 볼 수 있습니다.(로그인 필요)"
재가노인지원서비스 업무봉사,부산,부산진구,공통,"부산진구청 위탁 기관 입니다.본 기관은 재가노인지원서비스 및 주야간보호 서비스를 제공하고 있는 재가노인복지센터입니다.위치는 가야 지하철 3번출구에서 산복도로 방향에 있습니다.사무업무 보조 할 자원봉사자 선생님을 찾고 있습니다.기간은 3개월로 지정해두었으나 이후에도 지속적으로 가능한 분을 찾고 있으며,시간 및 요일은 협의하에 이루어지며, 가급적이면 고정으로 오실 수 있는 분을 찾습니다.어르신에게 질 높은 서비스를 제공할 수 있도록 도와주세요^^위치 : 부산진구 엄광로 292전화 : 051-951-0100*반드시 공고글 보시고 개인 휴대폰 및 기관으로 연락을 꼭 주시면 감사하겠습니다*※ 자원봉사희망자 정보는 신청자와 관리센터만 볼 수 있습니다.(로그인 필요)"
★ 자폐성장애인 산행 보조 봉사 ( 사단법인 밀알천사 ) ★,서울,서초구,공통,"자폐성 장애인들의 발전과 자립를 통한 나눔을 실천하는사단법인 밀알천사에서는 매 주 토요일마다 청계산 산행을 진행하고 있습니다.장애인들을 도와 산행을 처음부터 끝까지 함께 해 줄 봉사자를 모집합니다.평소 산행을 즐겨하시는 분들의 많은 참여를 부탁드리고요,아울러 봉사실적도 겸하여 챙겨가실 수 있는 좋은 기회이니까꼭 놓치지 마시기 바랍니다.## 대학생 동아리 또는 직장인 동호회 모임도 적극 환영합니다. ##1. 일   시 : 매주 토요일 오후 2시~6시 (공휴일휴무)2. 장   소 : 청계산 (원터골~옛골)3. 집결지 : 신분당선 청계산역 인근 원터골 입구 오후 1시 50분까지4. 대   상 : 중증 자폐성 장애인 산행 보조5. 준비물 : 산행용품(등산화, 스틱 등), 생수 / 겨울철 아이젠 필수※ 자원봉사희망자 정보는 신청자와 관리센터만 볼 수 있습니다.(로그인 필요)"
도서관업무봉사,서울,동대문구,공통,"- 금요일 오전 1명(10시~2시, 점심제공), 오후 1명(2시~6시)- 작은도서관 책놀이터 사무보조- 주요업무   . 오전근무자 : 도서관 문열기, 정수기 관리   . 오후봉사자 : 도서관 문 닫기, 정리정돈   . 이용자들이 사용한 컵 설겆이, 쓰레기 정리   . 도서관 전화응대   . 대출/반납. 도서정리- 문의 : 02-6383-2314(10:30~17:30) ※ 자원봉사희망자 정보는 신청자와 관리센터만 볼 수 있습니다.(로그인 필요)"
가족봉사단,강원,고성군,공통,복지시설이나 지역환경정화 및 말벗을 위한 자원봉사자모집안내※ 자원봉사희망자 정보는 신청자와 관리센터만 볼 수 있습니다.(로그인 필요)
장애·비장애 청소년 통합자원봉사단 ‘WECAN’ 신규단원모집,경기,광명시,공통,"가. 대상 : 광명시 거주 중, 고등학교 재학 중인 정기적, 지속적 봉사가 가능한 청소년 40명나. 활동기간 : 2019년 3월~12월다. 활동내용- 장애인식개선 교육 및 자원봉사 기초 소양교육- 단원 간 관계형성 프로그램- 다양한 계층 대상 봉사활동(계절별 맞춤 활동, 환경정화 활동 등)- 광명시 청소년 나눔축제 기획·진행- 지역 내 축제 참여(어린이날 행사, 오월의 난장 등)- 지역사회 캠페인 등라. 모집기간 : 2월 23일(토) ~ 2월 28일(목) 14시마. 지원방법 : 철산복지관 홈페이지(http://happycs.or.kr) 공지사항 게시글 내 지원서 다운로드 후 작성(사진 반드시 부착) → 방문제출(10시~18시) 및 면접                VMS , 1365를 통한 온라인 신청은 미인정바. 선정기준- 정기적인 봉사활동을 희망하는 중·고등학생 청소년- 자발적이며 지속적으로 봉사활동에 참여 의지가 있는 비장애 청소년※ 장애 청소년의 경우, 학교·유관기관 및 단체·학부모 등의 추천지원 가능합니다. ※ 자원봉사희망자 정보는 신청자와 관리센터만 볼 수 있습니다.(로그인 필요)"
스포츠 관련 프로그램 보조,전북,익산시,공통,"안녕하세요! 동산사회복지관입니다.저희 복지관에서는 스포츠 관련 프로그램 자원봉사자를 모집하고 있습니다.일시 : 매주 월요일, 금요일 (16시~19시)장소 : 동산사회복지관봉사활동 내용 : 클라이밍, 볼링, 롤러스케이트, 음악줄넘기, 체성분 검사, 체력검사 활동 보조봉사자격 : 스포츠(체육)관련 자격증 소유자 혹은 스포츠(체육)관련 학과 대학생문의사항 : 063-842-2253(주병규 사회복지사)※ 자원봉사희망자 정보는 신청자와 관리센터만 볼 수 있습니다.(로그인 필요)"
[송파구방이복지관]성인발달장애인 볼링교실 교육 봉사자 모집,서울,송파구,공통,"송파구방이복지관에서는 성인발달장애인을 대상으로 볼링교실을 진행함에 따라, 성인발달장애인들의 볼링 자세 또는 방법 등을 지도해주실 수 있는 봉사자를 모집합니다.-일시: 3월~12월 매주 화요일 오후 4시-6시-장소: 송파구 또는 강동구 내 볼링센터-대상: 성인발달장애인-내용: 성인발달장애인 대상 볼링 자세 및 진행 방법 등 지도※ 자원봉사희망자 정보는 신청자와 관리센터만 볼 수 있습니다.(로그인 필요)"
"장애청소년, 장애청년과 함께 하는 나들이 모임 '하늘달리기'",서울,은평구,공통,"*모집대상 : 18세~40세, 활동을 빠지지 않고 참여할 수 있는 분*활동장소 : 서울 지역 *교육날짜 : 3월 30~31일(토~일) 이틀동안 신입자원활동가 교육을 모두 이수해야 합니다.*활동날짜 : 매달 마지막 주 일요일 (4월 28일, 5월 26일, 6월 30일, 7월 28일, 8월 25일/변동가능성있음)*활동시간 : 오전11시~오후5시 (점심은 도시락을 싸와서 먹습니다. 활동종료후 함께 평가하는 시간까지 포함입니다)*기억해주세요 :  나들이장소 답사 및 나들이 외에 프로그램 기획 및 진행까지 자원활동가들이 함께 만들어가는 활동입니다.발달장애인과 함께 살아가는 법을 배우고 다양한 활동을 하고 싶어하는 분들의 신청을 기다립니다.※ 자원봉사희망자 정보는 신청자와 관리센터만 볼 수 있습니다.(로그인 필요)"
클린개포만들기 청소년 봉사자 모집,서울,강남구,공통,"능인종합사회복지관은 강남구 개포동(양재역 5번출구 근처)에 위치해있습니다.청소년 동아리가 특화되어 있으며, 그 중 매년 서울시 지원으로 운영되고 있는 '클린개포만들기'가 대표적입니다.최근 미세먼지 등 어느 지역을 가더라도 환경에 대한 문제가 이슈로 떠오르고 있는데요.이 환경정화활동의 주체로 청소년들이 직접 환경정화소품을 만들거나 길거리 캠페인을 하는 활동을 주로 진행하고 있습니다.정기적이고 의미있는 봉사활동을 찾는 청소년들의 많은 신청 바랍니다.1. 활동기간 : 2019년 3월 4주 ~ 11월 4주 (매월 2, 4주 토)2. 활동시간 : 오전 10:00 ~ 12:003. 활동장소 : 능인종합사회복지관 프로그램실, 인근 지역사회(양재역 5번출구 - 마을버스 강남10번 - 능인선원 하차)4. 활동내용 : 쓰레기줍기, 환경정화 교육, 소품만들기(공기정화 화분, em비누 등), 캠페인5. 참여혜택 : 매회 맛있는 간식 제공, 봉사활동 한 만큼 봉사시간 지급!!!!(1365, VMS)6. 문의/기타 : 02-571-2989 박정희 사회복지사※ 자원봉사희망자 정보는 신청자와 관리센터만 볼 수 있습니다.(로그인 필요)"
유소년야구교실 프로그램 보조활동,강원,영월군,공통,1. 봉사일자 : 2019-02-22~2019-11-282. 봉사장소 : 영월군 덕포야구장3. 봉사내용 : 유소년야구교실 프로그램 보조활동※ 자원봉사희망자 정보는 신청자와 관리센터만 볼 수 있습니다.(로그인 필요)
청소년 생태환경 자치동아리 에코워커 6기를 모집합니다.,서울,종로구,공통," 2019 Be a Young ECO worker환경과의 조화로운 삶을 고민하고 행동하는 청소년, 에코워커를 모집합니다.'에코워커'는 우리가 살고 있는 환경과 건강한 관계를 맺으며 살아가는 방법을 찾아보는 청소년 자치 동아리 입니다.<활동내용> 지역의 환경문제를 해결하고 생태환경을 지키기 위한 실천 프로젝트 전개(자연생태, 생활환경, 물, 에너지, 쓰레기, 환경정책 등)1회차(4월) - 에코워커@혜화 시작 - 오리엔테이션(함께 걸어가기 위해 서로에게 다가가는 시간)2회차(5월) - 에코워커@혜화 되다 - 활동주제 정하기(에코워커@혜화 2019 키워드)3회차(6월) - 에코워커@혜화 활동하다 - 에코워커@혜화 Action Ⅰ4회차(7월) - 에코워커@혜화 활동하다 - 에코워커@혜화 Action Ⅱ5회차(9월) - 에코워커@혜화 활동하다 - 에코워커@혜화 Action Ⅲ(대한민국 친환경대전)6회차(10월) - 에코워커@혜화 활동하다 - 에코워커@혜화 Action Ⅳ7회차(11월) - 에코워커@혜화 활동하다 - 에코워커@혜화 Action Ⅴ8회차(12월) - 에코워커@혜화 되돌아보다 - 활동 정리/2020년 계획<지원방법> 송석복지재단 홈페이지 공지사항(https://goo.gl/8xzJLi)에서 에코워커 지원서를 다운로드 후 이메일(songsukwf@gmail.com) 로 보내주시기 바랍니다.※ 자원봉사희망자 정보는 신청자와 관리센터만 볼 수 있습니다.(로그인 필요)"
