제목,지역,소분류,성별,내용
나래봉사단 대학생 자원봉사자 모집,서울,강동구,공통,"성내종합사회복지관과 함께 나래봉사단을 이끌어주실 대학생 자원봉사자를 모집합니다. - 활동내용: 고등학생 단원들과 함께 지역 내에서 다양한 캠페인 활동을 진행합니다. - 활동기간 및 일자는 아래 홍보물을 통해 확인해주세요.   ※ 토요일, 일요일 중 하루만 활동하셔도 되며, 가능하실 경우 이틀 모두 활동하셔도 됩니다. - 문의: 성내종합사회복지관 지역사회조직팀 유진성 대리 (070-4164-1202)※ 자원봉사희망자 정보는 신청자와 관리센터만 볼 수 있습니다.(로그인 필요)"
발달장애성인과 함께 하는 월 1회 나들이 '세상길들이기' 자원활동가 모집,경기,고양시,공통,"안녕하세요. 사단법인 평화캠프 고양지부에서 발달장애성인과 함께 한달에 한번 나들이 자원활동 <세상길들이기>에 함께 할 자원활동가를 모집합니다.발달장애성인과 일대일로 짝을 맺어 서로 소통하는 법과 함께 살아가는 법을 경험하고픈 분들이 함께 해주시기를 기다리고 있습니다.나이가 들수록 비장애인과 친구가 될 기회가 없는 발달장애인들과 한 달에 한 번 즐거운 시간을 보내고 싶습니다. *활동날짜 : 매달 두 번째 토요일(9월에만 추석연휴로 인해 셋째 주에 진행합니다)*활동시간 : 오전10시~오후5시 (점심 도시락은 각자 준비합니다)*첫 활동 및 교육 : 4월13일 오전10시, 주엽역 인근*활동내용 : 올해 활동 주제는 ‘숲’입니다. 숲의 맑은 기운과 함께 발달장애성인들과 나들이를 합니다. *활동신청 : 활동을 원하실 경우, vms에서 신청을 하시거나 구글독스로 신청서를 작성해주세요. https://goo.gl/rhUjgn※ 자원봉사희망자 정보는 신청자와 관리센터만 볼 수 있습니다.(로그인 필요)"
"청소년지역활동가 ""WITH"" 단원 모집",경기,파주시,공통,※ 자원봉사희망자 정보는 신청자와 관리센터만 볼 수 있습니다.(로그인 필요)
★무한도전 프로그램 봉사자 모집,부산,해운대구,공통,"***영진종합사회복지관 장애인과 3대 1 결연봉사자 모집합니다***활동일시: 4월~6월or7월~9월or10월~12월 (세 기간 중 한 기간만 활동합니다)활동내용: 장애인들의 소원목록리스트 달성을 도웁니다. 장애인들의 경우 홀로 외출 등이 어렵고, 외출의 주목적은 병원방문이라고 합니다. 평범한 일상 속의 행복을 찾아주실 분을 모집합니다. 활동비 지급합니다!!봉사자 연령 20세 이상 / 성별 무관문의: 영진종합사회복지관 주세희 사회복지사 051-529-0005※ 자원봉사희망자 정보는 신청자와 관리센터만 볼 수 있습니다.(로그인 필요)"
행복을 볶는 아이들(행볶아),부산,해운대구,공통,활동시기: 2019.4.~11.(주1회/금요일)활동내용: 초등학교 고학년 요리확동 프로그램 보조20세 이상/.성별무관VMS봉사활동 실적 인정(회기당2시간)문의 : 양지은 사회복지사(529-0005)※ 자원봉사희망자 정보는 신청자와 관리센터만 볼 수 있습니다.(로그인 필요)
[비산종합사회복지관] 청소년자원봉사단 사랑메아리 자원봉사자 모집합니다,경기,안양시,공통,"청소년자원봉사단 사랑메아리(작은 손길로 만들어가는 아름다운 세상)사랑메아리는 자원봉사를 희망하는 안양지역 내 청소년들이 모인 청소년 봉사단입니다.지역 내 청결, 관계, 나눔 등의 다양한 캠페인 활동을 기획, 진행, 평가하는 활동으로 진행됩니다.일시: 월 1회 토요일 9:30~12:30장소: 비산종합사회복지관(안양시 동안구 임곡로 74), 안양 지역내내용: 청소년이 직접 기획하고 진행하는 캠페인 활동문의: 최다영 사회복지사 031-446-5936, 070-8915-2868봉사활동 신청 후 유선연락을 통해 최종신청이 완료됩니다.담당자에게 꼭 연락주시기 바랍니다.많은 청소년 여러분의 참여를 바랍니다.^^※ 자원봉사희망자 정보는 신청자와 관리센터만 볼 수 있습니다.(로그인 필요)"
"노래, 마술, 웃음치료, 체조 등 여러활동(인천은빛요양원)",인천,남동구,공통,"1. 봉사일자 : 2019-04-07~2019-04-282. 봉사장소 : 인천은빛요양원3. 봉사내용 : 노래, 율동, 마술, 웃음치료 등 어르신께 즐거움을 줄 수 있는 활동   봉사기간 : 정기, 비정기 모두 가능하시고 봉사일은 직접 지정하실 수 있으세요                 다만 시간은 오후1시부터 가능하십니다.                  경력이 없으셔도 가능하시고 열정만 있으시면 됩니다.* 자세한 사항은 문자나 전화주시면 감사드리겠습니다 ※ 자원봉사희망자 정보는 신청자와 관리센터만 볼 수 있습니다.(로그인 필요)"
★급구★ 글로벌페스티벌 행사 자원봉사자(플래시몹) 모집,울산,남구,공통,"2019년 글로벌페스티벌 행사 자원봉사자(플래시몹) 모집 홍보 ○ 봉사일시 : 2019.5.11(토) 11:00~19:00                  13:000 리허설 / 16:50 공연 예정                  ※ 봉사시간 최대 16시간  인정(연습용 동영상 사전배부)○ 장소 : 남구 태화강둔치(태화로타리 근처)○ 모집분야 : 플레시몹○ 모집인원 : 100명(각 팀별 20명)○ 신청방법 : 한미림 ☎ 052)274-0935~6 으로 전화접수 ○ 주요내용 : 기념식 및 유공자 포상, 세계전통문화공연, 세계전통의상패션쇼, 울산글로벌 OX퀴즈대회, 외국인가요제, 글로벌댄스대회,                  퓨전요리대회, 세계의상체험, LET'S DANCE TOGETHER 파티, 세계문화홍보부스, VR-세계여행체험관, 출입국업무 및 취업                  지원 상담, 무료진료, 무료법률상담, K-뷰티 메이크업, 플리마켓, 푸드트럭 등○ 주최/주관 : 울산광역시/ 울산MBC 자원봉사자 명단을 오늘까지 명단을 제출해야 하므로, 5월 11일날 당일 자원봉사자가 가능하신 분은 052)274-0935로 바로 신청 부탁드립니다^^! ※ 자원봉사희망자 정보는 신청자와 관리센터만 볼 수 있습니다.(로그인 필요)"
[서울재활협회] 감동의 마라톤 자원봉사자 모집(4/20),서울,영등포구,공통,"1. 활동 내용  ※ 장애인 참가자가 많기 때문에 주의요망. - 대 회 명: 제3회 S-OIL과 함께하는 ‘감동의 마라톤’              (http://감동의마라톤.com)- 접수처: 현장 접수인원 확인 및 물품 전달- 출발 및 골인지: 출발 전/후 집결지 통제, 참가자 질서유지- 골인 급수대: 완주자들 물 제공- 간식 배부처: 완주자들 간식 제공- 물품보관소: 참가자 물품을 수령 및 전달, 보관하는 업무 수행- 탈의실: 질서유지, 비닐백 배포- 주로(코스)내 각 교차로 및 골목 차량 통행 안내 및 선수 주로 안내- 5km지점 이후부터 매 5km마다 급수 및 스펀지대 설치 및 선수음료제공- 마라톤 참가자(장애인, 비장애인) 기타 지원 활동 2. 모집기간- 2019.03.04.(월)~2018.04.14.(일) 3. 모집인원- 130명 4. 모집대상- 성별 무관. (단, 연령 17세~40세) 5. 모임장소- 여의도 이벤트광장(집결지)(지하철 5호선 여의나루역 2번 출구) 6. 모임시간- 2019.04.20.(토), 오전 7시(10분 전까지 도착) 7. 활동날짜 및 시간- 2019.04.20.(토), 오전 7시~오후 1시(총 6시간) 8. 신청방법- 담당자에게 아래 개인 신상 정보 이메일(rikorea-seoul@naver.com) 전달※ 이름/ 성별/ 연령/ 연락처/ 이메일 주소/ 장애유무/ VMS ID 전달  →개인 신상 정보 이메일 미전달시 최종 접수가 안된 상태이므로, 꼭 메일로 별도 전달 부탁드립니다. - 접수 후 확정된 봉사자는 개인 연락처로 회신 예정(1차 4/5, 최종 4/18) 9. 기타- 제공사항: 중식, 간식, 물- 지인 및 친구, 동아리 등 단체신청 가능문의) 서울특별시장애인재활협회, 봉사담당 정혜정 02-2637-4162 ※ 자원봉사희망자 정보는 신청자와 관리센터만 볼 수 있습니다.(로그인 필요)"
네일아트봉사자(전문가일필요없음) 모집(1일) ,서울,관악구,공통,"저소득 어르신의 정서 지원을 위한 네일아트 저소득 어르신들의 정서&경제적 지원을 위해 관악노인복지관에서 진행하는 바자회 행사에 어르신 네일아트 자원봉사자를 모집합니다.가. 일시 : 2019. 4. 25.(목), 09:00∼16:00나. 장소 : 관악노인종합복지관 앞마당다. 내용 : 네일폴리쉬를 이용한 간단한 네일아트 시술 (전문가일 필요 없음)          * 네일아트 재료와 식사는 모두 제공됩니다. (개인재료 지참가능) ※ 자원봉사희망자 정보는 신청자와 관리센터만 볼 수 있습니다.(로그인 필요)"
사무보조,서울,동대문구,공통,"사무지원자원봉사자 모집*문서파쇄, 복사, 서류정리 등 단순업무*평일 9~18시 중 원하는 요일, 시간대에 활동가능(최소 2시간이상. 12~13시는 점심 및 휴식시간, 개별식사)*봉사가능한 횟수만큼 신청가능*4월 이후에도 가능*신청자는 꼭 02)356-4889로 전화하여 가능한 일정 확인요망**vms신청하기만으로는 즉시 확인이 어려우므로 꼭 본.인.이 전화연락하여 일정조정요망※ 자원봉사희망자 정보는 신청자와 관리센터만 볼 수 있습니다.(로그인 필요)"
"장애청소년, 장애성인 나들이 모임 '하늘달리기'",서울,서대문구,공통,"*모집대상 : 18세~40세, 활동을 빠지지 않고 참여할 수 있는 분*활동장소 : 서울 은평구 지역 *교육날짜 : 3월 30~31일(토~일) 이틀동안 신입자원활동가 교육을 모두 이수해야 합니다.*활동날짜 : 매달 마지막 주 일요일 (4월 28일, 5월 26일, 6월 30일, 7월 28일, 8월 25일/변동가능성있음)*활동시간 : 오전11시~오후5시 (점심은 도시락을 싸와서 먹습니다. 활동종료후 함께 평가하는 시간까지 포함입니다)*기억해주세요 :  나들이장소 답사 및 나들이 외에 프로그램 기획 및 진행까지 자원활동가들이 함께 만들어가는 활동입니다.발달장애인과 함께 살아가는 법을 배우고 다양한 활동을 하고 싶어하는 분들의 신청을 기다립니다.※ 자원봉사희망자 정보는 신청자와 관리센터만 볼 수 있습니다.(로그인 필요)"
주부리폼봉사동아리 참여자 모집 ,인천,부평구,여,"주부여성들이 지역 내 봉사 활동에 필요한 가구DIY 기술을 배우고 배운 기술을 지역 내 나누는 주부 봉사 동아리 참여자를 모집합니다.관심있는 부평구 거주 주부여성들의 많은 신청 바랍니다.- 대상 : 부평구 거주 주부여성(30대-50대)- 활동요일 : 매주 목요일 오전 10시~12시- 활동내용 : DIY리폼 교육, 저소득 가정 가구 리폼봉사, 체험부스 및 바자회 진행 등- 신청기간 : 2019년 4월 3일(수)까지- 신청방법 : 전화 및 내방상담(삼산복지관, 주소 : 부평구 삼산동 157번지 삼산주공아파트 107동 1층)- 활동장소 : 인천시 부평구 삼산동 위치, 삼산종합사회복지관- 문의 : 삼산복지관 529-8607, 김종숙 ※ 자원봉사희망자 정보는 신청자와 관리센터만 볼 수 있습니다.(로그인 필요)"
화성시아르딤복지관 성인여성발달장애인을 위한 시민옹호 활동 자원봉사자 모집,경기,화성시,여,"활동기간: 2019.04 ~ 07월 매주 금요일활동시간: 14:00 ~ 16:00(2시간)모집인원: 여성자원봉사자(40대 이상) 10명활동장소: 화성시아르딤복지관활동내용: 여성 발달장애인과 자원봉사자가 1:1 매칭되어 자조모임, 간담회, 시민옹호인 양성교육 활동 및 미혼 여성발달장애인의 결혼,양육, 성에 관련된 교육 및 조언 등의 활동담당자 연락처: 031-5183-8978※ 자원봉사희망자 정보는 신청자와 관리센터만 볼 수 있습니다.(로그인 필요)"
2019년 전문자원봉사단 제11기 희울서포터즈 양성교육 모집안내!,인천,남동구,공통,"2019년 전문자원봉사단 제11기 희울서포터즈 양성교육 모집안내 인천노인전문기관은 학대받는 어르신에 대해 긴급상담, 현장조사, 쉼터입소 등의 보호조치를 하며 지역사회에서 노인학대를 예방하고 노인의 인권을 보호하고자 노인복지법 시행규칙 제39조의5제3항 규정에 의하여 인천광역시로부터 지정된 노인학대예방 및 상담기관입니다. [희울서포터즈] 란 학대받는 어르신들을 보호하는 ""희망의 울타리""를 뜻합니다. ""희울서포터즈는 학대받은 어르신에 대해 심리상담연계, 사후모니터링 등의 상담과 기관의 홍보 및 예방교육, 후원모금, 후원품 지급, 노인우울 실태조사 등의 활동을 하며 지역사회에서 노인학대를 예방하고 노인의 인권을 보호하고자 설립된 인천광역시노인보호전문기관의 전문자원봉사단""입니다. * 모집 대상: 자원봉사 및 노인분야에서 활동할 수 있는 성인(평일 활동시간 및 자원봉사의 특수성 때문에 성인으로 제한합니다)* 모집 인원: 선착순 모집 15명* 모집 기한: 2019년 5월 3일(금) 18시까지* 모집 분야: 학대피해노인 상담 및 사후관리 (방문 및 전화)                캠페인 홍보 활동 및 교육진행보조                후원모금함 수거 및 재비치                노인우울 실태조사                기타 행사 보조 등* 교육 일정: 5.9(목), 13:30~17:30, 2층 204호 교육실                5.16(목), 13:30~17:30, 2층 204호 교육실                5.23(목), 13:30~17:30, 2층 204호 교육실* 교육장소: 인천사회복지회관(남동구 용천로 208) 205호 교육실               (자세한 내용은 기관홈페이지 참조)* 신청 방법: 기관홈페이지(www.ic1389.or.kr) “게시판 -> 공지사항 -> “2019년 전문자원봉사단 제11기 희울서포터즈 양성교육 모집안내” 게시글에서 2019 자원봉사신청서 다운 후 작성하여 팩스 및 이메일 또는 유선전화를 통한 신청* 교육문의 전화: 426-8792~3   팩스: 426-8794   Email: ic1389@hanmail.net   담당: 이행호 상담원* 교육수료 특전 : 1) 자원봉사시간부여(단, 추후 자원봉사 활동 후 시간 부여)                       2) 전문자원봉사자 교육이수 수료증 수여※ 자원봉사희망자 정보는 신청자와 관리센터만 볼 수 있습니다.(로그인 필요)"
[서울재활협회] 감동의 마라톤 자원봉사자 모집(4/20),서울,영등포구,공통,"1. 활동 내용  ※ 장애인 참가자가 많기 때문에 주의요망. - 대 회 명: 제3회 S-OIL과 함께하는 ‘감동의 마라톤’              (http://감동의마라톤.com)- 접수처: 현장 접수인원 확인 및 물품 전달- 출발 및 골인지: 출발 전/후 집결지 통제, 참가자 질서유지- 골인 급수대: 완주자들 물 제공- 간식 배부처: 완주자들 간식 제공- 물품보관소: 참가자 물품을 수령 및 전달, 보관하는 업무 수행- 탈의실: 질서유지, 비닐백 배포- 주로(코스)내 각 교차로 및 골목 차량 통행 안내 및 선수 주로 안내- 5km지점 이후부터 매 5km마다 급수 및 스펀지대 설치 및 선수음료제공- 마라톤 참가자(장애인, 비장애인) 기타 지원 활동 2. 모집기간- 2019.03.04.(월)~2018.04.14.(일) 3. 모집인원- 130명 4. 모집대상- 성별 무관. (단, 연령 17세~40세) 5. 모임장소- 여의도 이벤트광장(집결지)(지하철 5호선 여의나루역 2번 출구) 6. 모임시간- 2019.04.20.(토), 오전 7시(10분 전까지 도착) 7. 활동날짜 및 시간- 2019.04.20.(토), 오전 7시~오후 1시(총 6시간) 8. 신청방법- 담당자에게 아래 개인 신상 정보 이메일(rikorea-seoul@naver.com) 전달※ 이름/ 성별/ 연령/ 연락처/ 이메일 주소/ 장애유무/ VMS ID 전달  →개인 신상 정보 이메일 미전달시 최종 접수가 안된 상태이므로, 꼭 메일로 별도 전달 부탁드립니다. - 접수 후 확정된 봉사자는 개인 연락처로 회신 예정(1차 4/5, 최종 4/18) 9. 기타- 제공사항: 중식, 간식, 물- 지인 및 친구, 동아리 등 단체신청 가능문의) 서울특별시장애인재활협회, 봉사담당 정혜정 02-2637-4162 ※ 자원봉사희망자 정보는 신청자와 관리센터만 볼 수 있습니다.(로그인 필요)"
반찬지원서비스 조리 및 배달 봉사자 모집,부산,북구,공통,"<반찬지원서비스> 자원봉사자 모집합니다~~*반찬지원서비스란? ->지역 내 결식 및 영양 결핍을 에방하고자 본 기관에서는 배주 수요일마다 반찬을 필요로하는 저소득층 및 독거노인들에게 반찬을 지원하고 있습니다.1.모집기간 : 상시2.봉사자 성별 및 연령 : 무관3.봉사모집 분야 : 조리 및 배달 -조리 : 매주 수요일 14:00~16:00 (희망하는 날로 조정 가능) -배달 : 매주 수요일 16:00~18:00 (희망하는 날로 조정 가능) ※조리의 경우, 반찬조리가 불가능하더라도 식재료 손질 보조해주시면 되고,배달의 경우, 꼭 차량을 이용하지 않더라도 도보로 배달가능합니다!4. 문의 및 신청 : 박지은 사회복지사(070-4825-8414)※ 자원봉사희망자 정보는 신청자와 관리센터만 볼 수 있습니다.(로그인 필요)"
[서울재활협회] 감동의 마라톤 자원봉사자 모집(4/20),서울,영등포구,공통,"1. 활동 내용  ※ 장애인 참가자가 많기 때문에 주의요망. - 대 회 명: 제3회 S-OIL과 함께하는 ‘감동의 마라톤’              (http://감동의마라톤.com)- 접수처: 현장 접수인원 확인 및 물품 전달- 출발 및 골인지: 출발 전/후 집결지 통제, 참가자 질서유지- 골인 급수대: 완주자들 물 제공- 간식 배부처: 완주자들 간식 제공- 물품보관소: 참가자 물품을 수령 및 전달, 보관하는 업무 수행- 탈의실: 질서유지, 비닐백 배포- 주로(코스)내 각 교차로 및 골목 차량 통행 안내 및 선수 주로 안내- 5km지점 이후부터 매 5km마다 급수 및 스펀지대 설치 및 선수음료제공- 마라톤 참가자(장애인, 비장애인) 기타 지원 활동 2. 모집기간- 2019.03.04.(월)~2018.04.14.(일) 3. 모집인원- 130명 4. 모집대상- 성별 무관. (단, 연령 17세~40세) 5. 모임장소- 여의도 이벤트광장(집결지)(지하철 5호선 여의나루역 2번 출구) 6. 모임시간- 2019.04.20.(토), 오전 7시(10분 전까지 도착) 7. 활동날짜 및 시간- 2019.04.20.(토), 오전 7시~오후 1시(총 6시간) 8. 신청방법- 담당자에게 아래 개인 신상 정보 이메일(rikorea-seoul@naver.com) 전달※ 이름/ 성별/ 연령/ 연락처/ 이메일 주소/ 장애유무/ VMS ID 전달  →개인 신상 정보 이메일 미전달시 최종 접수가 안된 상태이므로, 꼭 메일로 별도 전달 부탁드립니다. - 접수 후 확정된 봉사자는 개인 연락처로 회신 예정(1차 4/5, 최종 4/18) 9. 기타- 제공사항: 중식, 간식, 물- 지인 및 친구, 동아리 등 단체신청 가능문의) 서울특별시장애인재활협회, 봉사담당 정혜정 02-2637-4162 ※ 자원봉사희망자 정보는 신청자와 관리센터만 볼 수 있습니다.(로그인 필요)"
[본리종합사회복지관]아동프로그램 정기자원봉사자 모집,대구,달서구,공통,"[본리종합사회복지관]아동프로그램 ""아마존탐험대"" 정기자원봉사자(대학생) 모집달서구 지역 학령기 아동들의 마을공동체 회복을 위한 마을탐험 프로젝트 아마존탐험대-아이들 마음에 존(좋은의 줄임말이자 ZONE:지역.마을 탐험대)본 사업은 3~12월까지 연간 진행되는사업으로 프로그램 참여아동과 함께 프로그램의 전반적인 활동을 실시하며, 프로그램 진행시 보조 및 안전보호 역할도 수행하고 아동과 함께정서적 교류를 나눌 수 있는 봉사자를 모집합니다.프로그램 내용은 다음과 같습니다.-기간 : 2019.3.23.~2019.12.31. 매월 토요일 2회 실시-장소 : 본리복지관 및 복지관관할구역일대(성당,감삼,두류,본리)-내용 : 아마존탐험대 마을탐험 활동 진행 보조 및 안전보호 등의 멘토활동-대상 : 대구,경북지역 거주하는 대학생 봉사자 3명(전공무관)-문의 : 053-563-1007, 사회복지팀 권민경 사회복지사※ 자원봉사희망자 정보는 신청자와 관리센터만 볼 수 있습니다.(로그인 필요)"
대명사회복지관 남구복지한마당부스 운영보조 자원봉사자 모집,대구,남구,공통,<대명사회복지관 남구복지한마당부스 운영보조 자원봉사자 모집> 1)일시 : 2019년 4월 27일 (토) 12시~16시 / 16시~20시 (20명)           2019년 4월 28일 (일) 12시~15시 / 15시~18시 (20명)                        *종일봉사도 가능합니다*2)장소 : 대구 남구 앞산빨래터 일대3)내용 : 남구복지한마당부스 활동 운영보조4)문의 : 지역사회조직팀 구지현 사회복지사          (T.053-657-1170) ※ 자원봉사희망자 정보는 신청자와 관리센터만 볼 수 있습니다.(로그인 필요)
[행사진행보조 및 체험부스운영] 어린이날 행사 자원봉사자를 모십니다.,충남,홍성군,공통,"빈곤아동이 한 명도 없는 나라를 꿈꾸며 33여 년간 소외 아동·청소년들과 함께한 사단법인 부스러기사랑나눔회 입니다.부스러기사랑나눔회 충남지부에서는 충청남도로부터 위탁받아 지역아동센터 충남지원단을 운영하고 있습니다.오는 5월4일(토) 충청남도 주최로 지역아동센터 및 아동양육시설의 아동들과 함께하는 어린이날 행사가 개최됩니다,이 행사를 함께 만들어갈 봉사자를 모십니다. 함께 경험하며 좋은 인연 만들 수 있는 봉사자 여러분의 많은 신청바랍니다. 1. 모집기간: 2019년 3월 20일(수)~ 모집완료시 까지 2. 모집대상(총 40명)① 사진촬영(2명)- 사진 및 영상 촬영에 특기가 있는 자- 아동에 대한 이해와 관심이 있고, 해당 특기가 있는 봉사자② 체험부스운영(20명)- 아동들과 체험부스활동 유경험자, 제기 만들기, 공기놀이 등 함께 즐기며 놀 수 있는 자③ 먹거리 운영부스 가능자(10여명)- 팝콘, 솜사탕, 슬러쉬 등④ 기타 행사 진행보조 (8명)3. 봉사일시: 2019년 5월 4일(토) 09:00~16:00(6시간)4. 봉사장소: 충남문예회관, 충남도청내5. 봉사내용:- 행사당일 발표회 사진 촬영 및 동영상 촬영- 체험부스 운영 및 행사진행보조 6. 제출서류 : 봉사활동일지(활동당일 작성) 7. 문의 : 지역아동센터 충남지원단041-557-2729/ cneducarer@hanmail.net ※ 자원봉사희망자 정보는 신청자와 관리센터만 볼 수 있습니다.(로그인 필요)"
월드비전 경기남부지역본부 행정업무 지원,경기,수원시,공통,1. 봉사일자 : 2019-03-19~2020-03-12 (상시)2. 봉사장소 : 월드비전 경기남부지역본부3. 봉사내용 : 월드비전 경기남부지역본부 행정업무 지원문의 박주만 간사010-3167-8682 ※ 자원봉사희망자 정보는 신청자와 관리센터만 볼 수 있습니다.(로그인 필요)
만들기 봉사활동,서울,구로구,공통,봉사활동 신청은 메일(share@worldshare.or.kr) 혹은 전화(070-4170-1540) 로 부탁드립니다. ※ 자원봉사희망자 정보는 신청자와 관리센터만 볼 수 있습니다.(로그인 필요)
