제목,지역,소분류,성별,내용
[기아대책] 행복한나눔 길음점 자원봉사 모집,서울,성북구,공통,"기아대책 (재)행복한나눔 길음점 자원봉사를 모집합니다.기아대책 행복한나눔은 개인과 기업의 기증품을 판매하여 그 수익금으로 국내외 소외된 이웃을 돕는 사회적기업입니다.1. 모집분야: 나눔가게 길음점 매장 자원봉사2. 봉사내용: 매장 물품 판매 및 정리정돈과 매니저 업무보조3. 모집인원: 00명4. 봉사시간:  10:00 - 19:00 (월요일 ~ 금요일) , 정기/ 비정기 모집.  5. 지원기간: 상시 모집.            6. 위치: 서울시 성북구 정릉로52길 23 (4호선 길음역 도보 10분)7. 지원방법:  VMS 접수 신청, 이메일 신청(nomadjo@kfhi.or.kr)                  *별도의 지원양식은 없으며 [문래점 자원봉사] 제목으로 성함과 연락처 남겨주세요.※ 자원봉사희망자 정보는 신청자와 관리센터만 볼 수 있습니다.(로그인 필요)"
굿네이버스 가족그림편지쓰기대회 진행보조,경남,진주시,공통,"굿네이버스는?1991년 한국에서 설립되어 국내, 북한 및 해외에서 굶주림 없는 세상, 더불어 사는 세상을 만들기 위해전문사회복지사업과 국제개발협력사업을 활발히 수행하고 있는 국제구호개발 NGO입니다.굿네이버스 가족그림편지쓰기대회는?영유아 친구들이 지구촌 어려운 친구들을 돌아보고 이해하며, 세계시민으로 성장할 수 있도록 돕는나눔인성교육 프로그램입니다.* 활동명 : 굿네이버스 가족그림편지쓰기대회 물품세팅* 활동일시 : 2019년 4월 23일(화) ~ 25일(목), 오전 10:00~12:00 / 오후 13:00~18:00* 활동장소 : 굿네이버스 경남서부지부(경남 진주시 진주대로847 관성빌딩 3층)* 신청문의 : 이병인 대리(010-3345-5817)※ 자원봉사희망자 정보는 신청자와 관리센터만 볼 수 있습니다.(로그인 필요)"
은평봄봄축제 전동휠체어축구 홍보 부스 운영 도움 봉사자 모집합니다. ,서울,은평구,공통,"-은평봄봄축제 전동휠체어축구 홍보 부스 운영 도움 봉사자를 모집합니다.1. 일자: 2019.04.20(토) 오전 10시~18시까지2. 장소: 은평평화공원3. 필요인원: 2명4. 자격요건: 전동휠체어 사용 가능자, 전동휠체어축구 경험자※ 자원봉사희망자 정보는 신청자와 관리센터만 볼 수 있습니다.(로그인 필요)"
여성시각장애인 체험활동 안내보행 자원봉사자 모집,서울,강동구,여,"시각장애인 성인 여성 체험활동에 함께 할 자원봉사자를 모집합니다.1. 일자: 4월 30일(화)2. 시간: 09:30-16:303. 장소: 세미원, 두물머리(중앙선 양수역)4. 내용- 집결장소: 5호선 상일동역 3번 출구 역내 대합실(9시 20분) or 5호선 왕십리역(방화방면 2-1번 승차장) 10시 택 1- 활동내용 1) 1:1 체험 보조(함께 동행하여 설명 읽어주거나 만질수 있는 것 함께 하는 등) 연령대가 높은 편이므로 함께 이야기 나누시면서 이동과 체험 시 옆에서 보조해주새면 됩니다. 즐겁게 함께 시간을 보내시면 됩니다.2) 활동 전, 시각장애인 안내보행 및 신청서 작성 교육 진행합니다. * 점심식사 제공됩니다.* 이용자와 1:1로 진행됩니다.(일대일 매칭된 시각장애인 분들과 이야기 나누시면서 체험활동과 이동 안내해 주시면 됩니다)* 이용자와의 성비를 맞추기 위해(화장실 문제 등) 여성 자원봉사자를 모집합니다.* 준비사항 : 편안한 옷차림, 가방, 긍정적인 마인드, vms 아이디* 자원봉사자 모집은 아래와 같이 진행됩니다.1) vms 신청2) 담당자와 통화(02-440-5282)3) 최종 선정 문자 발송- vms만 신청하셨다고 당일 무작정 참석하시면 안됩니다. 한국시각장애인복지관 www.hsb.or.kr담당자: 이충화 02-440-5282 (주중 오전 9시~오후 6시) ※ 자원봉사희망자 정보는 신청자와 관리센터만 볼 수 있습니다.(로그인 필요)"
『 경기남양주아동보호전문기관 - 아동학대예방 인형극』 함께 해주실 자원봉사자를 모집합니다!,경기,남양주시,공통,"『 경기남양주아동보호전문기관 - 아동학대예방 인형극 자원봉사자 모집 』 1. 활동 일시 : 2019년 4월 30일 ~2019년 11월 30일 (연 7회) 2. 활동 시간 : 오전 09:00-12:00 (3시간씩) 3. 모집 기간 : 2019년 4월 16일 ~ 2019년 4월 30일 4. 활동 장소 : 구리, 남양주 관내 초등학교 및 병설유치원 5. 모집 대상 : 성인 2명 6. 활동 내용: 아동학대예방 인형극 진행 (막대 인형극)7. 주의사항※ 기존 인형극 자원봉사자 어머님분들과 즐겁고, 성실하게 자원봉사활동 해주실 수 있는 분들의 많은 지원 부탁드립니다.※ 매회 자원봉사 당일 반드시 ☆★시간 엄수☆★ 부탁드립니다!!※ 신청승인 후, 봉사 활동 내용에 대한 자세한 안내 사항은 개별연락 드릴 예정입니다. ※ 자원봉사희망자 정보는 신청자와 관리센터만 볼 수 있습니다.(로그인 필요)"
백석LH공동육아나눔터 지킴이활동가(대학생) 모집합니다.,충남,천안시,공통,"백석LH공동육아나눔터 지킴이활동가(대학생) 모집합니다.○ 활동내용: 공동육아나눔터 이용자 및 공간 관리< 세부내용 > ○ 장     소: 백석LH공동육아나눔터(충남 천안시 서북구 한들1로 88, 백석LH천년나무1단지 )○ 기     간: 지킴이 자원봉사 임명 ~ 2019.12.31.(연장가능)○ 시     간: 화,수, 16~18시 ○ 인     원: 2명○ 모집기간: 상시모집○ 기     타: VMS 자원봉사 활동시간 지급○ 문     의: 070-7733-7915 ※ 지원서 이메일 제출(chfsc1004@daum.net)후 담당자 통화※ 지원서는 자유양식입니다. ※ 자원봉사희망자 정보는 신청자와 관리센터만 볼 수 있습니다.(로그인 필요)"
[희망TV SBS] 스튜디오 녹화 방청 봉사자 모집,서울,양천구,공통,"1.희망TV SBS 소개희망TV SBS는 소외된 이웃을 위해 모금뿐 아니라 누구나 참여하고 즐기는 적극적인 기부축제를 지향하며 시청자와 NGO가 함께 만드는 대표적인 사회공헌 프로그램입니다. 2. 활동내용희망TV SBS로 해외봉사를 다녀온 연예인과 함께하는 스튜디오 녹화방송 참관 자원봉사입니다. 여러분의 많은 관심과 참여 부탁드립니다. 3. 활동장소서울시 양천구 목동서로 161 SBS 방송국 1층(지하철 5호선 오목교역 1번 or 2번 출구) 4. 활동시간2019년 5월3일(금) 17:30~20:30 (총 3시간)* 간식 지급* 진행상황에 따라 시간 변동 가능 5. 신청기간2019.4.22.까지 6. 기타장시간 앉아있어야 하니 편안한 복장으로 오십시오. 7. 문의밀알복지재단 정광옥 주임, 070-7462-9036 ※ 자원봉사희망자 정보는 신청자와 관리센터만 볼 수 있습니다.(로그인 필요)"
[굿네이버스] 경기1본부 펀드레이징 분야 NGO봉사단 2기 모집,경기,성남시,공통,"[특전]-직접 캠페이너로서 굿네이버스 사업에 대해 이해하고 체험할 수 있는 절호의 기회!-뻔~~한 활동이 아닌 나만의 스토리를 만들 수 있는 기회!-말로만 들었던 어려운 펀드레이징을 쉽게 재밌게 알 수 있는 기회!-유쾌한 굿네이버스 직원이 전해주는 입사 노하우 및 꿀팁 제공 기회! [모집인원] 00명 [모집대상]-굿네이버스 사업 및 국제구호개발 NGO활동에 관심이 있는 분-NGO봉사단 활동기간을 성실히 완수할 수 있는 분-굿네이버스 사업 안내에 대해 적극적이고 열정적으로 임할 수 있는 분-봉사정신과 책임감이 강하며 범죄 경력이 없는 자-대학교 재학생, 복학생, 휴학생, 졸업생 등 학력, 거주지역 무관 [활동기간] 12:30-18:00(5시간)/주1~2회(월~금요일 중 선택) [NGO봉사단 활동 혜택]-봉사시간 인증(VMS) 및 NGO봉사단 수료증 지급-굿네이버스 입사 Pre인턴십 제공 (차등 지급)-NGO단체 캠페이너 활동 경험-굿네이버스 사업 및 NGO관련 교육 제공 [활동내용]-국내외 아이들의 좋은 변화를 만들어 가기 위한 주1회 캠페이너-굿네이버스가 다루고 있는 국내 및 국제이슈를 통한 나눔문화 캠페인 진행-굿네이버스 내 사업 및 행사 참여-거리시민들이 나눔에 동참할 수 있도록 적극적인 캠페이너 활동-SNS를 통한 굿네이버스 홍보활동  [접수 및 문의방법]-접수 : VMS 접수 / 문의 : 굿네이버스 경기1본부 문유라 간사 T.031-778-7020*굿네이버스와 함께 세상을 위한 좋은변화를 이루어가는데 동참해주실 여러분들의 적극적인 참여 부탁드립니다*※ 자원봉사희망자 정보는 신청자와 관리센터만 볼 수 있습니다.(로그인 필요)"
♥(사)자원봉사능력개발원후원의밤 자원봉사자 모집♥,대구,중구,공통,"♥(사)자원봉사능력개발원후원의밤 자원봉사자를 모집합니다♥(사)자원봉사능력개발원은 지역에서 활동하고있는 비영리 민간사회단체로, 대구지역 쪽방주민의 권리옹호와 생계지원을 위해 활동하는쪽방상담소를 운영하는 법인입니다. 올해  23주년을 맞아 지역의 쪽방주민, 북한이탈주민을 위한성금마련을 위한 후원의밤을 준비하고 있으니 봉사자 여러분의 많은 도움 바랍니다.일시 : 2019년 5월 16일 (목)시간 : 12:00 ~24:00 *행사준비 및 정리까지 시간이 오래 걸리니봉사자분들은 활동이 가능한 시간을 담당자와 협의하셔서가능한 시간만큼 활동해주시면 됩니다활동내용 : 후원의밤 행사 안내, 홀정리(밤 늦게 까지 봉사하시는 분들 귀가비 지급해드립니다)장소 : 대구 중구 종로45-4, 몬스터즈 크래프트비어 자원봉사자 모집인원 : 20명★ 자원봉사활동확인서 발급가능★ 많은 참여 부탁드립니다^^ 대구쪽방상담소, 행복나눔의집 053)719-3497담당자 : 유경진 010-5196-0715※ 자원봉사희망자 정보는 신청자와 관리센터만 볼 수 있습니다.(로그인 필요)"
교육공동체가 함께하는 교권존중 공감토론 및 교권존중 & 학교폭력 캠페인  참가 도우미,경남,창원시,공통,"사단법인 경남좋은학교운동연합입니다. 본 연합회 행사의 일환으로 [교권존중 공감토론 및 범도민 캠페인] 행사 자원봉사자를 모집하오니, 시간 확인하셔서 5월 11일 오전9시50분~오후3시10분 까지 시간 가능하신 자원봉사자 여러분의 신청 기다립니다.(단, 여러단체 신청하셔서 연락없이 오시지 않는 분은 사양합니다!!) * 일시 : 5월 11일(토요일) 오전10시 ~ 12시(공감토론)/중식 제공/ 오후1시40분 ~ 오후 3시10분 * 장소 : 경남교원단체총연합회 2층 대회의실 앞 집결 - 공감토론 참석(이후 상남동 이동 후 중식)       - 캠페인 부스존 도우미(포스트잇 붙이기, 포토존 등)       - 거리 홍보 기념품 및 핀버튼 나눠주기       - 캠페인 참여 등(생수 및 간식 지급) * vms사이트 조회시 성명(필수)과 vms사이트 등록된 본인 아이디 또는 주민번호 앞 6자리(생년월일) 필요할 수 있습니다.* 행사 관련 봉사자 모집수 또는 성별 관련 본 회 사정에 따라 변경될 수 있습니다! < 궁금하신 사항은 아래의 연락처로 연락주시면 됩니다.> * 오전10시 ~ 오후5시 문의 : 055)299-9196 * 오후 5시 ~ 오후6시 이후 문의 : 010-6555-1358 * 오후 6시 이후엔 이름, 연락처 문자남겨주시면 확인후 연락드리겠습니다~감사합니다^^※ 자원봉사희망자 정보는 신청자와 관리센터만 볼 수 있습니다.(로그인 필요)"
[긴급] 영유아 아이돌봄 지원,서울,중랑구,공통,일시: 2019년 4월 17일(수) 10:00~12:00장소: 중랑구건강가정지원센터(중랑구 용마산로 369)활동내용: 부모교육 진행 시 영유아 아이돌봄긴급하게 모집하고 있으니 많은 관심과 참여를 부탁드립니다. ※ 자원봉사희망자 정보는 신청자와 관리센터만 볼 수 있습니다.(로그인 필요)
센터 청결활동 봉사자 모집,서울,송파구,공통,1. 봉사일자 : 2019-04-19(금) 13시~17시(4시간)2. 봉사장소 : THE채움장애인주간보호센터(서울시 송파구 위례광장로 200 위례아이온스퀘어 9층)3. 봉사내용 : 센터 청결활동 (장애인들이 이용하는 공간을 청소하는 것입니다.)4. 비      고 : 문의는 문자로 주시면 답변드리겠습니다.※ 자원봉사희망자 정보는 신청자와 관리센터만 볼 수 있습니다.(로그인 필요)
[사랑의달팽이]우편발송 업무 봉사자 모집(4/22),서울,중구,공통,"[사랑의달팽이]우편발송 업무 봉사자 모집(사)사랑의달팽이는 청각장애인에게 인공달팽이관 수술 및 보청기를 지원하고그 이후 소리를 듣게 된 아이들의 재활을 위해 클라리넷앙상블연주단을 운영하며사회적응지원과 대중들의 인식개선사업을 하고 있는 비영리단체입니다.(사)사랑의달팽이에서 우편발송 작업을 도와주실 봉사자를 모집합니다.* 봉사일시 : 2019. 04. 22.(월) 10:00~18:00_8시간 (점심식사 제공)* 봉사장소 : 사랑의달팽이 사무국 (약수역 10번출구)* 주소 : 서울특별시 중구 동호로15길 27, 종하빌딩 A동 1층 사랑의달팽이* 봉사업무 : 우편발송을 위한 간단한 작업 봉사* 문의사항은 사랑의달팽이(02-541-9555/070-4322-4137)으로 연락주시기 바랍니다.* 봉사신청해주시면 확인연락을 드리겠습니다. 꼭 답변 부탁드립니다.^^  ※ 자원봉사희망자 정보는 신청자와 관리센터만 볼 수 있습니다.(로그인 필요)"
[한국시각장애인복지관] 시각장애인과 함께 걷는 동행 봉사활동,서울,광진구,공통,"<2019년도 건강걷기활동 동행 자원봉사자 모집> 한국시각장애인복지관에서는 재가시각장애인을 대상으로 평소 운동량이 부족한 시각장애인에게‘건강걷기 활동’을 통하여 건강하고 활력 있는 삶을 제공하고자합니다이에 건강걷기활동에 동행해 주실 자원봉사자분을 모집합니다. 1. 봉사기간 : 2019년 4월 26일(금)2. 봉사시간 : 13시30분~16시00분(끝나는 시간 변동 있음)3. 봉사장소 : 아차산역 4번출구 개찰구(실내) 4. 모집인원 : 4명5. 모집대상- 시각장애인과 함께 걷기 활동에 관심이 있는 분6. 봉사내용 : 시각장애인 걷기활동 진행 보조7. VMS 신청 후 담당자가 개별 연락드립니다. 개별 연락 후 최종선정여부를 안내드립니다(문자, 전화)담당자: 한국시각장애인복지관 권영민담당자 연락처: 010-3212-2899, 02-440-5333담당자 이메일: ky871222@hsb.or.kr※ 자원봉사희망자 정보는 신청자와 관리센터만 볼 수 있습니다.(로그인 필요)"
[서울청소년수련관] 대학생 자원봉사단 '예그리나' 3기 단원 모집,서울,중구,공통,1. 봉사일자 : 2019-04-15~2019-12-312. 봉사장소 : 서울청소년수련관 및 서울 지역3. 봉사내용 : [서울청소년수련관] 대학생 자원봉사단 '예그리나' 3기 단원 모집4. 활동일정:  - 오리엔테이션 : 2019년 4월 27일(토) 10:00-13:00  - 매월 넷째주 토요일 (연 10회)  - 상세 일정 아래 공식 홈페이지 참조5. 접수방법아래 공식 홈페이지 첨부문서(참가신청서) 작성 후 이메일 접수 ( ajc9012@nate.com)http://www.youthc.or.kr/community/bprogram.asp?temp=view&idx=8893&code=youth_program&page=16. 문의  전화 : 02-2267-2111  카카오톡 : ajc9012※ 자원봉사희망자 정보는 신청자와 관리센터만 볼 수 있습니다.(로그인 필요)
[세이브더칠드런] 신생아살리기 캠페인 모자 정리(박스포장) 자원봉사자 모집,서울,마포구,남,"안녕하세요.전 세계 120여개 국가에서 아동 권리를 옹호하고, 실현하기 위해 활동하는 국제구호개발 NGO, 세이브더칠드런입니다.'신생아살리기 캠페인 시즌12'를 통해 수거된 모자를 아프리카 코트디부아르로 보내기 위한 모자 박스 포장 작업을 도와주실 자원봉사자를 모집합니다.※ 신생아살리기 캠페인?2007년 부터 '신생아살리기 모자뜨기 캠페인'으로 시작, 일교차가 큰 국가(지역)의 신생아에게 직접 뜬 모자를 보내는 국내대표 참여형 캠페인입니다.직접 뜬 모자는 아기들의 체온을 2℃ 정도 올려주고, 면역력을 증가시켜 아기들이 앞으로 건강한 삶을 살아가는데 도움을 줍니다.참여자분들이 보내주신 모자는 해당 지역의 신생아에게 전달되며, 모자와 함께 산모와 아기를 위한 필수 의약품, 산전/후 검진 등을 지원합니다.1. 일시 : 2019년 4월 20일(토), 오전10-17시2. 내용 : 신생아살리기 캠페인 모자 박스 포장 및 정리 작업- 주 활동 : 모자를 상자에 담아 테이핑(포장)하는 작업- 기타 : 모자를 속봉투에 담아 상자에 넣는 작업 등3. 모집인원 : 선착순 00명(박스를 포장하고 나르는 작업이 많으므로 이 점 고려하여 신청해주시기 바랍니다.)4. 신청방법 ★ 신청 즉시 확정되는 것은 아니며, 확정문자를 받아야 신청 완료입니다. ★(1) VMS를 통해 자원봉사 신청(2) 확정문자를 받으면 신청 완료※ 확정문자(확정한 당일 발송) 및 안내문자(봉사활동 전날)를 발송해드립니다. ※5. 기타- 점심식사를 제공합니다.- 자원봉사활동 확인증 발급됩니다. (VMS)기타 문의사항이 있으신 경우 아래의 연락처 및 이메일로 문의주시기 바랍니다.전화 : (02) 2126-4352 (평일 오전9-18시, 점심시간12-13시 제외)이메일 : moja@sc.or.kr관심있는 분들의 많은 참여를 부탁드립니다.감사합니다.※ 자원봉사희망자 정보는 신청자와 관리센터만 볼 수 있습니다.(로그인 필요)"
[풍납종합사회복지관]어르신과 함께하는 봄나들이 봉사자 모집,서울,송파구,공통,"어르신과 함께하는 ‘안성팜랜드’ 봄 나들이!거동이 불편한 어르신들이 함께 나들이를 갈 수 있도록 여러분의 많은 관심을 기다리고 있습니다.1. 코스 : 풍납종합사회복지관(출발) - 담양 석갈비(점심식사) - 안성팜랜드(관광) - 풍납종합사회복지관(복귀)2. 봉사일시 : 2019.04.26.(금) 9:30 집결 - 18:303. 봉사내용 : 거동불편 어르신 휠체어 부축하여 나들이 장소 관람4. 봉사모집인원 : 3명* 문의 : 풍납복지관 이수민 사회복지사 02-474-1201(자리에 없으면 메모 남겨주시면, 답드릴게요~!)※ 자원봉사희망자 정보는 신청자와 관리센터만 볼 수 있습니다.(로그인 필요)"
오산남부청소년문화의집 청소년방과후아카데미 피아노 반주자 자원봉사 모집,경기,오산시,공통,"안녕하세요, 오산남부청소년문화의집 청소년방과후아카데미입니다.2019년 5월 25일 방과후칸타빌레 합창대회 반주자를 찾습니다.5월 25일 합창대회를 준비하기 위하여 매주 월요일 오후 18시 20분~ 19시 20분, 목요일 오후 3시 30분 ~ 4시 30분(1시간) 연습이 있습니다.월요일 또는 목요일 가능하신 요일에 반주해주실 반주자 분을 찾습니다. ※ 자원봉사희망자 정보는 신청자와 관리센터만 볼 수 있습니다.(로그인 필요)"
꿈을주는과일 포장 행사 자원봉사자 모집!,서울,강남구,공통," <과일지원사업 ‘꿈을주는과일’ 자원봉사 모집>꿈을주는과일재단에서는 저소득층 아이들을에게 매달 제철과일이 들어간 꿈을주는과일을 선물하고 있습니다.  재단과 함께 이 꿈을주는과일상자를 포장해주실 자원봉사자를 모집합니다.준비된 과일을 차례차례 상자에 넣으면 되는 간단한 업무 입니다. 자세한 내용은 꿈을주는과일재단 홈페이지에서 확인하실 수 있습니다.*봉사 일시- 2019년 4월 25일(목) 12:30~16:30*봉사내용 : 아이들에게 선물할 과일을 담아 포장하는 활동입니다.*봉사 장소 :꿈을주는과일재단 사무실 집합 후 구리농수산물 도매시장으로 이동하여 과일 포장 -> 활동 후 재단 사무실로 복귀하여 마무리*재단 주소 : 서울시 강남구 밤고개로 21길 71 명품빌딩 3층- 수서역 부근 재단사무실에서 사전 교육 후, 행사장으로 함께 이동합니다.(30분 소요/재단차량이용)- VMS를 통해 신청하시면, 담당자가 확인연락 드립니다.- 더 자세한 내용은 재단홈페이지(www.dreamfruit.org)를 참고하세요.- 문의 있으신 분께서는 전화나 메일로 연락주세요.※ 자원봉사희망자 정보는 신청자와 관리센터만 볼 수 있습니다.(로그인 필요)"
[굿네이버스 경기구리남양주]구리시유채꽃축제 아동권리옹호캠페인 진행 봉사자자 모집,경기,구리시,공통,[구리시유채꽃축제 아동권리옹호캠페인 진행 봉사자 모집]-내용: 굿네이버스 아동권리옹호캠페인-기간: 2019년 5월 10일~2019년 5월 12일-시간: 10:00~18:00 (부분 참여 가능)-활동내용: 캠페인 부스 설치 및 운영                구리시유채꽃 축제 참여 시민들을 대상으로 아동권리옹호캠페인 내용 설명-신청방법: [구리시유채꽃축제 캠페인 참여/이름/나이/성별/활동가능일/시간] 작성하여 010-8599-9806 문자 신청-담당자: 굿네이버스 좋은마음센터 경기구리남양주 이혜수 간사(031-524-9922) ※ 자원봉사희망자 정보는 신청자와 관리센터만 볼 수 있습니다.(로그인 필요)
화성시 위기가정 sos기금마련을 위한 나래울 봄더하기 축제 자원봉사자 모집 ,경기,화성시,공통,"안녕하세요?나래울종합사회복지관에서는 화성시 위기가정 sos기금마련을 위한 나래울 봄 더하기 축제를 기획하였으며, 행사를 함께 운영해주실자원봉사자를 모집합니다. 지역주민 여러분들의 많은 관심과 참여 부탁드립니다,1. 행사일시 : 2019년 4월 27일(토) 9:00-16:002. 봉사활동 : 먹거리 판매, 바자회 판매, 체험부스 및 기타 행사 보조3. 봉사대상 : 대학생, 성인 자원봉사자(*아동, 청소년 자원봉자는 제외합니다.)4. 문      의 : 지역조직팀 031-8015-7410※ 자원봉사희망자 정보는 신청자와 관리센터만 볼 수 있습니다.(로그인 필요)"
화성시 위기가정 sos기금마련을 위한 나래울 봄더하기 축제 자원봉사자 모집 ,경기,화성시,공통,"안녕하세요?나래울종합사회복지관에서는 화성시 위기가정 sos기금마련을 위한 나래울 봄 더하기 축제를 기획하였으며, 행사를 함께 운영해주실자원봉사자를 모집합니다. 지역주민 여러분들의 많은 관심과 참여 부탁드립니다,1. 행사일시 : 2019년 4월 26일(금) 9:00-16:002. 봉사활동 : 먹거리 판매, 바자회 판매, 체험부스 및 기타 행사 보조3. 봉사대상 : 대학생, 성인 자원봉사자(*아동, 청소년 자원봉자는 제외합니다.)4. 문      의 : 지역조직팀 031-8015-7410※ 자원봉사희망자 정보는 신청자와 관리센터만 볼 수 있습니다.(로그인 필요)"
